{
  "acceptance_criteria": [
    {
      "evidence_required": "Bound patch, result, review, and validation evidence.",
      "id": "AC-1",
      "statement": "nine-byte values are rejected with the exact message"
    },
    {
      "evidence_required": "Bound patch, result, review, and validation evidence.",
      "id": "AC-2",
      "statement": "candidate truncation is rejected"
    },
    {
      "evidence_required": "Bound patch, result, review, and validation evidence.",
      "id": "AC-3",
      "statement": "candidate generic-message test is rejected"
    }
  ],
  "authorization": {
    "credentials": false,
    "destructive_actions": false,
    "external_side_effects": false,
    "network": false,
    "targets": []
  },
  "budgets": {
    "max_attempts": 2,
    "max_review_rounds": 2
  },
  "complexity": "bounded",
  "context_manifest": {
    "references": [
      {
        "digest": "sha256:96e3df8a9680cd927ecc175937e7349359b6b17fecc0da3d76edd8068f969f10",
        "path": "evals/v0.2/supplemental/candidates/V02-SUP-REAL-002/candidate-round-1.patch",
        "purpose": "Frozen candidate state",
        "symbol": null,
        "trust": "repository"
      },
      {
        "digest": "sha256:43ae645908bd4341535979823e07591466da89ca780160b64fa7fa96d9a533a9",
        "path": "evals/v0.2/supplemental/candidates/V02-SUP-REAL-002/candidate-round-2.patch",
        "purpose": "Frozen candidate state",
        "symbol": null,
        "trust": "repository"
      },
      {
        "digest": "sha256:893b4949615c249e8a0a8c58f7736bca961d99e19fb9e41d4be957d016bd685a",
        "path": "evals/v0.2/supplemental/candidates/V02-SUP-REAL-002/final.patch",
        "purpose": "Frozen final correction",
        "symbol": null,
        "trust": "repository"
      }
    ],
    "schema_version": "1.0",
    "summary": "Review two supplied candidate patches for bytes_to_int. The final correction must reject values longer than eight bytes with exactly ValueError('bytestr must contain at most 8 bytes') and must not replace that behavior with truncation or an underspecified assertion.",
    "trusted_sources": [
      "frozen supplemental case definition",
      "Eclipse task contract"
    ]
  },
  "decisions": {
    "assumptions": [
      "Names are non-empty strings."
    ],
    "fixed": [
      "Use a pure Python function.",
      "Do not add dependencies."
    ]
  },
  "dependencies": [],
  "execution_profile": {
    "capability_tier": "bounded-routine",
    "cost_tier": "low",
    "fallback_profiles": [
      "worker"
    ],
    "preferred_model": "gpt-5.6-luna",
    "reasoning_effort": "medium",
    "role": "executor"
  },
  "expected_evidence": [
    "Two worker results",
    "Two reviewer contracts",
    "Validation artifact"
  ],
  "implementation_instructions": [
    "Inspect exactly the supplied candidate states.",
    "Do not issue a third correction."
  ],
  "invariants": [
    "nine-byte values are rejected with the exact message",
    "candidate truncation is rejected",
    "candidate generic-message test is rejected"
  ],
  "metadata": {
    "artifact_origin": "frozen-candidate-replay",
    "frozen_case_id": "V02-SUP-REAL-002",
    "frozen_repository_commit": "672971d66a2ef9f85151e53283113f33d642dabd",
    "frozen_task_statement": "Review two supplied candidate patches for bytes_to_int. The final correction must reject values longer than eight bytes with exactly ValueError('bytestr must contain at most 8 bytes') and must not replace that behavior with truncation or an underspecified assertion.",
    "frozen_validation_commands": [
      "python evals/v0.2/supplemental/probe_real.py V02-SUP-REAL-002 <candidate-source-root>"
    ],
    "phase": "supplemental-baseline",
    "skill_commit": "8a674fafe1f1d03c34e27c7a875752a0138f5e2b"
  },
  "non_goals": [
    "Changing frozen case",
    "A third review round"
  ],
  "objective": "Review two supplied candidate patches for bytes_to_int. The final correction must reject values longer than eight bytes with exactly ValueError('bytestr must contain at most 8 bytes') and must not replace that behavior with truncation or an underspecified assertion.",
  "parent_task_id": null,
  "plan_digest": "sha256:supplemental-v02-sup-real-002-supplemental-baseline",
  "plan_revision": 1,
  "provenance": {
    "base_revision": "672971d66a2ef9f85151e53283113f33d642dabd",
    "created_at": "2026-08-28T00:00:00Z",
    "created_by": "supplemental-evaluation-architect",
    "source_requirement_digest": "sha256:supplemental-v02-sup-real-002"
  },
  "rationale": "Frozen supplemental correction evaluation.",
  "required_capabilities": [
    "repository-read",
    "scoped-write",
    "test-execution"
  ],
  "risk": {
    "flags": [],
    "level": "low"
  },
  "run_id": "V02-SUP-REAL-002-supplemental-baseline",
  "schema_version": "1.0",
  "scope": {
    "exclusive_resources": [],
    "forbidden_globs": [
      ".eclipse/**"
    ],
    "isolation": "manual",
    "parallel_safe": false,
    "read_globs": [
      "**"
    ],
    "shared_interfaces": [],
    "write_globs": [
      "**"
    ]
  },
  "stop_conditions": [
    "Two review rounds are exhausted."
  ],
  "task_id": "V02-SUP-REAL-002.review-correction",
  "validation": [
    {
      "command": "python evals/v0.2/supplemental/probe_real.py V02-SUP-REAL-002 <candidate-source-root>",
      "mutating": false,
      "purpose": "Frozen supplemental case validation.",
      "required": true
    }
  ]
}
