{
  "acceptance_criteria": [
    {
      "evidence_required": "Bound patch, result, review, and validation evidence.",
      "id": "AC-1",
      "statement": "negative input raises the exact ValueError"
    },
    {
      "evidence_required": "Bound patch, result, review, and validation evidence.",
      "id": "AC-2",
      "statement": "the uint64 boundary test remains"
    },
    {
      "evidence_required": "Bound patch, result, review, and validation evidence.",
      "id": "AC-3",
      "statement": "both candidate defects are identified before acceptance"
    }
  ],
  "authorization": {
    "credentials": false,
    "destructive_actions": false,
    "external_side_effects": false,
    "network": false,
    "targets": []
  },
  "budgets": {
    "max_attempts": 2,
    "max_review_rounds": 2
  },
  "complexity": "bounded",
  "context_manifest": {
    "references": [
      {
        "digest": "sha256:f466aee96fbe5acac10159bd8ce35b92148923267edca1c1a42eb53cab9b46ae",
        "path": "evals/v0.2/supplemental/candidates/V02-SUP-REAL-001/candidate-round-1.patch",
        "purpose": "Frozen candidate state",
        "symbol": null,
        "trust": "repository"
      },
      {
        "digest": "sha256:b764ff7aa226b2a140407f696f41b2e5d40ca3b907bb8d71cdef9c50d6e5a594",
        "path": "evals/v0.2/supplemental/candidates/V02-SUP-REAL-001/candidate-round-2.patch",
        "purpose": "Frozen candidate state",
        "symbol": null,
        "trust": "repository"
      },
      {
        "digest": "sha256:52db2dbfbcaf1af15e5be543ae090ec6484b09ec7ac8a789a1edd5b6cbce0085",
        "path": "evals/v0.2/supplemental/candidates/V02-SUP-REAL-001/final.patch",
        "purpose": "Frozen final correction",
        "symbol": null,
        "trust": "repository"
      }
    ],
    "schema_version": "1.0",
    "summary": "Review two supplied candidate patches for int_to_bytes. The final correction must reject negative values with exactly ValueError('num must be non-negative') while preserving the uint64 boundary regression. At most two review rounds are available.",
    "trusted_sources": [
      "frozen supplemental case definition",
      "Eclipse task contract"
    ]
  },
  "decisions": {
    "assumptions": [
      "Names are non-empty strings."
    ],
    "fixed": [
      "Use a pure Python function.",
      "Do not add dependencies."
    ]
  },
  "dependencies": [],
  "execution_profile": {
    "capability_tier": "bounded-routine",
    "cost_tier": "low",
    "fallback_profiles": [
      "worker"
    ],
    "preferred_model": "gpt-5.6-luna",
    "reasoning_effort": "medium",
    "role": "executor"
  },
  "expected_evidence": [
    "Two worker results",
    "Two reviewer contracts",
    "Validation artifact"
  ],
  "implementation_instructions": [
    "Inspect exactly the supplied candidate states.",
    "Do not issue a third correction."
  ],
  "invariants": [
    "negative input raises the exact ValueError",
    "the uint64 boundary test remains",
    "both candidate defects are identified before acceptance"
  ],
  "metadata": {
    "artifact_origin": "frozen-candidate-replay",
    "frozen_case_id": "V02-SUP-REAL-001",
    "frozen_repository_commit": "672971d66a2ef9f85151e53283113f33d642dabd",
    "frozen_task_statement": "Review two supplied candidate patches for int_to_bytes. The final correction must reject negative values with exactly ValueError('num must be non-negative') while preserving the uint64 boundary regression. At most two review rounds are available.",
    "frozen_validation_commands": [
      "python evals/v0.2/supplemental/probe_real.py V02-SUP-REAL-001 <candidate-source-root>"
    ],
    "phase": "supplemental-baseline",
    "skill_commit": "8a674fafe1f1d03c34e27c7a875752a0138f5e2b"
  },
  "non_goals": [
    "Changing frozen case",
    "A third review round"
  ],
  "objective": "Review two supplied candidate patches for int_to_bytes. The final correction must reject negative values with exactly ValueError('num must be non-negative') while preserving the uint64 boundary regression. At most two review rounds are available.",
  "parent_task_id": null,
  "plan_digest": "sha256:supplemental-v02-sup-real-001-supplemental-baseline",
  "plan_revision": 1,
  "provenance": {
    "base_revision": "672971d66a2ef9f85151e53283113f33d642dabd",
    "created_at": "2026-08-28T00:00:00Z",
    "created_by": "supplemental-evaluation-architect",
    "source_requirement_digest": "sha256:supplemental-v02-sup-real-001"
  },
  "rationale": "Frozen supplemental correction evaluation.",
  "required_capabilities": [
    "repository-read",
    "scoped-write",
    "test-execution"
  ],
  "risk": {
    "flags": [],
    "level": "low"
  },
  "run_id": "V02-SUP-REAL-001-supplemental-baseline",
  "schema_version": "1.0",
  "scope": {
    "exclusive_resources": [],
    "forbidden_globs": [
      ".eclipse/**"
    ],
    "isolation": "manual",
    "parallel_safe": false,
    "read_globs": [
      "**"
    ],
    "shared_interfaces": [],
    "write_globs": [
      "**"
    ]
  },
  "stop_conditions": [
    "Two review rounds are exhausted."
  ],
  "task_id": "V02-SUP-REAL-001.review-correction",
  "validation": [
    {
      "command": "python evals/v0.2/supplemental/probe_real.py V02-SUP-REAL-001 <candidate-source-root>",
      "mutating": false,
      "purpose": "Frozen supplemental case validation.",
      "required": true
    }
  ]
}
