{
  "acceptance_criteria": [
    {
      "evidence_required": "Bound patch, result, review, and validation evidence.",
      "id": "AC-1",
      "statement": "non-ASCII str raises BadData"
    },
    {
      "evidence_required": "Bound patch, result, review, and validation evidence.",
      "id": "AC-2",
      "statement": "the malformed base64 regression remains"
    },
    {
      "evidence_required": "Bound patch, result, review, and validation evidence.",
      "id": "AC-3",
      "statement": "valid encoded values still decode"
    }
  ],
  "authorization": {
    "credentials": false,
    "destructive_actions": false,
    "external_side_effects": false,
    "network": false,
    "targets": []
  },
  "budgets": {
    "max_attempts": 2,
    "max_review_rounds": 2
  },
  "complexity": "bounded",
  "context_manifest": {
    "references": [
      {
        "digest": "sha256:c2e4b7a1325f5af01587d8187e3021b72f29cb85b8994e6776749116ae3cc03b",
        "path": "evals/v0.2/supplemental/candidates/V02-SUP-REAL-003/candidate-round-1.patch",
        "purpose": "Frozen candidate state",
        "symbol": null,
        "trust": "repository"
      },
      {
        "digest": "sha256:89d15e0b09b5889549667bc795b14b46de1ecbf6740d03a3aa3e7fdd039517ec",
        "path": "evals/v0.2/supplemental/candidates/V02-SUP-REAL-003/candidate-round-2.patch",
        "purpose": "Frozen candidate state",
        "symbol": null,
        "trust": "repository"
      },
      {
        "digest": "sha256:82bb792e595b86bd4a2e819cb70cbb2b417faa4a716a27f6583e85e9c33efff3",
        "path": "evals/v0.2/supplemental/candidates/V02-SUP-REAL-003/final.patch",
        "purpose": "Frozen final correction",
        "symbol": null,
        "trust": "repository"
      }
    ],
    "schema_version": "1.0",
    "summary": "Review two supplied candidate patches for base64_decode. The final correction must raise BadData for non-ASCII str input while preserving valid string and bytes decoding. Reject the deleted regression and the leaked UnicodeEncodeError before accepting a bounded correction.",
    "trusted_sources": [
      "frozen supplemental case definition",
      "Eclipse task contract"
    ]
  },
  "decisions": {
    "assumptions": [
      "Names are non-empty strings."
    ],
    "fixed": [
      "Use a pure Python function.",
      "Do not add dependencies."
    ]
  },
  "dependencies": [],
  "execution_profile": {
    "capability_tier": "bounded-routine",
    "cost_tier": "low",
    "fallback_profiles": [
      "worker"
    ],
    "preferred_model": "gpt-5.6-luna",
    "reasoning_effort": "medium",
    "role": "executor"
  },
  "expected_evidence": [
    "Two worker results",
    "Two reviewer contracts",
    "Validation artifact"
  ],
  "implementation_instructions": [
    "Inspect exactly the supplied candidate states.",
    "Do not issue a third correction."
  ],
  "invariants": [
    "non-ASCII str raises BadData",
    "the malformed base64 regression remains",
    "valid encoded values still decode"
  ],
  "metadata": {
    "artifact_origin": "frozen-candidate-replay",
    "frozen_case_id": "V02-SUP-REAL-003",
    "frozen_repository_commit": "672971d66a2ef9f85151e53283113f33d642dabd",
    "frozen_task_statement": "Review two supplied candidate patches for base64_decode. The final correction must raise BadData for non-ASCII str input while preserving valid string and bytes decoding. Reject the deleted regression and the leaked UnicodeEncodeError before accepting a bounded correction.",
    "frozen_validation_commands": [
      "python evals/v0.2/supplemental/probe_real.py V02-SUP-REAL-003 <candidate-source-root>"
    ],
    "phase": "supplemental-v0.2",
    "skill_commit": "4438280c502e1e0d9e667e841206cc19b8e6521e"
  },
  "non_goals": [
    "Changing frozen case",
    "A third review round"
  ],
  "objective": "Review two supplied candidate patches for base64_decode. The final correction must raise BadData for non-ASCII str input while preserving valid string and bytes decoding. Reject the deleted regression and the leaked UnicodeEncodeError before accepting a bounded correction.",
  "parent_task_id": null,
  "plan_digest": "sha256:supplemental-v02-sup-real-003-supplemental-v0.2",
  "plan_revision": 1,
  "provenance": {
    "base_revision": "672971d66a2ef9f85151e53283113f33d642dabd",
    "created_at": "2026-08-28T00:00:00Z",
    "created_by": "supplemental-evaluation-architect",
    "source_requirement_digest": "sha256:supplemental-v02-sup-real-003"
  },
  "rationale": "Frozen supplemental correction evaluation.",
  "required_capabilities": [
    "repository-read",
    "scoped-write",
    "test-execution"
  ],
  "risk": {
    "flags": [],
    "level": "low"
  },
  "run_id": "V02-SUP-REAL-003-supplemental-v0.2",
  "schema_version": "1.0",
  "scope": {
    "exclusive_resources": [],
    "forbidden_globs": [
      ".eclipse/**"
    ],
    "isolation": "manual",
    "parallel_safe": false,
    "read_globs": [
      "**"
    ],
    "shared_interfaces": [],
    "write_globs": [
      "**"
    ]
  },
  "stop_conditions": [
    "Two review rounds are exhausted."
  ],
  "task_id": "V02-SUP-REAL-003.review-correction",
  "validation": [
    {
      "command": "python evals/v0.2/supplemental/probe_real.py V02-SUP-REAL-003 <candidate-source-root>",
      "mutating": false,
      "purpose": "Frozen supplemental case validation.",
      "required": true
    }
  ]
}
